{
  "identity": {
    "premise": "A persistent, numbered proof rail intersects the content exactly where an operator must verify a claim.",
    "primary_carrier": "narrative",
    "carrier_rule": "Let the proof rail organize every consequential decision.",
    "recurring_carriers": ["Evidence seam", "Numbered proof marker"],
    "marks": [{"mark_id": "wordmark", "status": "not-applicable", "role": "This direction uses no separate mark.", "clear_space": "Not applicable until a mark is commissioned.", "minimum_size": "Not applicable until a mark is commissioned.", "colorways": [], "prohibited_uses": ["Do not invent a placeholder logo."]}],
    "usage_constraints": ["Keep routine controls quiet."],
    "recognition_tests": ["The evidence seam remains recognizable without the accent color."]
  },
  "color": {
    "roles": [
      {"token": "paper", "name": "Paper", "value": "#F2F1EC", "role": "canvas", "usage": "Primary reading field."},
      {"token": "ink", "name": "Ink", "value": "#151917", "role": "content", "usage": "Text and structural rules."},
      {"token": "signal", "name": "Signal", "value": "#1F5D4D", "role": "state", "usage": "Confirmed evidence only."}
    ],
    "semantic_mappings": ["Signal means verified and is never decorative."],
    "modes": ["Light is canonical; print preserves role separation."],
    "contrast_method": "Verify WCAG contrast from rendered foreground and background pairs."
  },
  "typography": {
    "roles": [
      {"role": "display", "family": "Approved Evidence Serif", "source": "project-owned font asset", "license_evidence": "docs/design/font-rights.md#approved-evidence-serif", "fallback": "Georgia, serif", "weight_style": "600 normal", "usage": "Short proof declarations only."},
      {"role": "body", "family": "system-ui", "source": "operating system", "license_evidence": "platform supplied", "fallback": "sans-serif", "weight_style": "400 normal", "usage": "Explanations and controls."}
    ],
    "scale": [{"token": "display", "value": "clamp(3rem, 8vw, 7rem)", "usage": "Opening claim."}, {"token": "body", "value": "1rem/1.55", "usage": "Sustained reading."}],
    "measure": "Body copy stays between 45 and 70 characters.",
    "responsive_behavior": "Display copy wraps to two lines before scale drops."
  },
  "spatial": {
    "base_unit": "4px",
    "spacing_tokens": [{"token": "space-1", "value": "4px", "usage": "Inline separation."}, {"token": "space-4", "value": "16px", "usage": "Control groups."}, {"token": "space-8", "value": "32px", "usage": "Section rhythm."}],
    "grid": "Twelve columns desktop, eight tablet, four mobile.",
    "container": "Maximum 1600px with fluid side margins.",
    "transformations": [{"context": "desktop", "rule": "Proof and rationale share a spread."}, {"context": "tablet", "rule": "Proof leads and rationale follows."}, {"context": "mobile", "rule": "Document order replaces the spread."}]
  },
  "form_assets": {
    "shape_rules": ["Use square evidence fields and one-pixel rules."],
    "iconography_rules": ["Use labeled symbols only when text is insufficient."],
    "imagery_rules": ["Use owned working evidence with explicit crops."],
    "material_rules": ["Paper and ink carry the system; signal color marks state."],
    "prohibited_uses": ["No decorative gradients or detached logo rows."]
  },
  "motion": {
    "status": "specified",
    "rationale": "Motion reveals proof state without changing reading order.",
    "tokens": [{"token": "reveal", "duration": "180ms", "easing": "ease-out", "usage": "Disclosure only."}],
    "reduced_motion": "Open in place without travel."
  },
  "voice": {
    "principles": ["State the decision before the explanation."],
    "approved_examples": ["Evidence is current through this revision."],
    "avoid_examples": ["Revolutionary next-generation experience."]
  },
  "application_modes": [{"mode": "primary", "rule": "Use the full seam for orientation and proof."}, {"mode": "utility", "rule": "Use numbered markers and quiet rules."}, {"mode": "quiet", "rule": "Remove display scale but retain evidence order."}],
  "governance": {
    "source_refs": ["intent-evidence-first"],
    "decision_rationale": ["The carrier turns evidence into structure."],
    "prohibited_substitutions": ["Do not replace the seam with generic cards."],
    "acceptance_checks": ["Every consequential claim remains adjacent to evidence."],
    "drift_checks": ["Review palette, type transfer, carrier, responsive behavior, and provenance together."]
  }
}
